{
  "version": "vate-jose-proof-fixture-2026-09",
  "proof_type": "detached_jws",
  "payload_canonicalization": "json-sorted-no-whitespace",
  "evidence_type": "runtime_attestation",
  "issuer": "did:web:agent.example",
  "protected": {
    "alg": "ES256",
    "kid": "did:web:agent.example#runtime-key-1",
    "typ": "vate-evidence+jws"
  },
  "protected_b64u": "eyJhbGciOiJFUzI1NiIsImtpZCI6ImRpZDp3ZWI6YWdlbnQuZXhhbXBsZSNydW50aW1lLWtleS0xIiwidHlwIjoidmF0ZS1ldmlkZW5jZStqd3MifQ",
  "detached_payload_b64u": "eyJhcnRpZmFjdF9kaWdlc3QiOnsiYWxnIjoic2hhLTI1NiIsInZhbHVlIjoiYmFzZTY0dXJsLXJ1bnRpbWUtYXR0ZXN0YXRpb24tZGlnZXN0In0sImF1ZGllbmNlIjoiaHR0cHM6Ly92ZXJpZmllci5leGFtcGxlL2EyYSIsImV2aWRlbmNlX3R5cGUiOiJydW50aW1lX2F0dGVzdGF0aW9uIiwiZXhwaXJlc19hdCI6IjIwMjYtMDctMDFUMDA6MjA6MDBaIiwiaXNzdWVkX2F0IjoiMjAyNi0wNy0wMVQwMDoxNTowMFoiLCJpc3N1ZXIiOiJkaWQ6d2ViOmFnZW50LmV4YW1wbGUiLCJub25jZSI6Im5vbmNlLWpvc2UtZGV0YWNoZWQtMDAxIiwicHJvZmlsZSI6IlZBVEUtQUwyLVZlcmlmaWVyLUFkbWlzc2lvbi12MC4zIiwic3ViamVjdCI6eyJhY3RvciI6ImRpZDp3ZWI6YWdlbnQuZXhhbXBsZSIsInJ1bnRpbWUiOiJzcGlmZmU6Ly9hZ2VudC5leGFtcGxlL3dvcmtsb2FkL2Nhc2UtYWdlbnQifSwidmVyc2lvbiI6InZhdGUtam9zZS1wcm9vZi1maXh0dXJlLTIwMjYtMDkifQ",
  "detached_payload_sha256": {
    "alg": "sha-256",
    "value": "0000000000000000000000000000000000000000000000000000000000000000"
  },
  "signature_b64u": "Zml4dHVyZS1zaWduYXR1cmUtaW52YWxpZA",
  "signing_input_sha256": {
    "alg": "sha-256",
    "value": "7a82eae7e583b12662e91ed1c18dfde0a9b0c1df94d1ba541fbceed3505425eb"
  }
}
