{
  "version": "vate-jose-proof-fixture-2026-09",
  "proof_type": "detached_jws",
  "payload_canonicalization": "json-sorted-no-whitespace",
  "evidence_type": "runtime_attestation",
  "issuer": "did:web:agent.example",
  "protected": {
    "alg": "ES384",
    "kid": "did:web:agent.example#runtime-key-1",
    "typ": "vate-evidence+jws"
  },
  "protected_b64u": "eyJhbGciOiJFUzM4NCIsImtpZCI6ImRpZDp3ZWI6YWdlbnQuZXhhbXBsZSNydW50aW1lLWtleS0xIiwidHlwIjoidmF0ZS1ldmlkZW5jZStqd3MifQ",
  "detached_payload_b64u": "eyJhcnRpZmFjdF9kaWdlc3QiOnsiYWxnIjoic2hhLTI1NiIsInZhbHVlIjoiYmFzZTY0dXJsLXJ1bnRpbWUtYXR0ZXN0YXRpb24tZGlnZXN0In0sImF1ZGllbmNlIjoiaHR0cHM6Ly92ZXJpZmllci5leGFtcGxlL2EyYSIsImV2aWRlbmNlX3R5cGUiOiJydW50aW1lX2F0dGVzdGF0aW9uIiwiZXhwaXJlc19hdCI6IjIwMjYtMDctMDFUMDA6MjA6MDBaIiwiaXNzdWVkX2F0IjoiMjAyNi0wNy0wMVQwMDoxNTowMFoiLCJpc3N1ZXIiOiJkaWQ6d2ViOmFnZW50LmV4YW1wbGUiLCJub25jZSI6Im5vbmNlLWpvc2UtZGV0YWNoZWQtMDAxIiwicHJvZmlsZSI6IlZBVEUtQUwyLVZlcmlmaWVyLUFkbWlzc2lvbi12MC4zIiwic3ViamVjdCI6eyJhY3RvciI6ImRpZDp3ZWI6YWdlbnQuZXhhbXBsZSIsInJ1bnRpbWUiOiJzcGlmZmU6Ly9hZ2VudC5leGFtcGxlL3dvcmtsb2FkL2Nhc2UtYWdlbnQifSwidmVyc2lvbiI6InZhdGUtam9zZS1wcm9vZi1maXh0dXJlLTIwMjYtMDkifQ",
  "detached_payload_sha256": {
    "alg": "sha-256",
    "value": "6312b66b7b1771dc478f474f74fae0f5a9194a80d63271b26cfe24fc6e60dcd3"
  },
  "signature_b64u": "Zml4dHVyZS1zaWduYXR1cmUtZXMzODQtaW52YWxpZA",
  "signing_input_sha256": {
    "alg": "sha-256",
    "value": "930539b7889a3f9024bea36c3760469c4d3af7828e93b0b156aca49130d6a6f3"
  }
}
